,Id,Category,Tweet
3026,638519370902294530,neutral,also didnt budge on backing Planned Parenthood came out for boots on the ground to defeat ISIS Back to everywhere Fri
3027,638640331299405824,negative,Hes calling out the slime in DC I dont like his support of Planned Parenthood I think hes tax plan may be lax
3028,638760832822734848,negative,Prolifers held a large rally in Petoskey on Saturday They were protesting Planned Parenthood the nations 
3029,638768064427855872,negative,If it werent for Christians the Aztecs would never have stopped killing babies like Planned Parenthood does 
3030,638856131004243968,neutral,ICYMI Heres what you must know about Texas decision to defund cancer screenings  Planned Parenthood on Sept  
3031,638904223212642304,positive, I will be watching Friday night at est your special report on the Planned Parenthood scandal 
3032,638904316288327680,negative,Love my butst item under The Week in issue about Planned Parenthood scandal was beneath you I expect a little more friends
3033,638904475038654465,negative,Ninth Shocking Video One Just Fell Out of the Womb Time to prosecute Planned Parenthood 
3035,638961808284479488,negative,Missouri Health Dept May be Allowing Planned Parenthood to Break the Law to Do Abortions 
3036,639051256133255168,negative,Planned Parenthood Sells Intact Aborted Babies One Just Fell Out of the Womb 
3037,639055108936830976,negative,It just fell out of the wombth sting video shows how Planned Parenthood easily gets intact foetuses from  
3038,639118270843387904,negative,Late on Monday the Obama administration filed a socalled statement of interest at the court in support of Planned Parenthood 
3039,639213159589507072,negative,The future must not belong to the butchers of Planned Parenthoodth video via 
3040,639234396814508032,positive,RandPaul Tune in to Fox News Friday night for a special on Planned Parenthood brought to you by ShannonBream 
3041,639240002665320448,negative,just because the media wont say anything about it Planned Parenthoods still doing its thrifty genocidal thing 
3042,639315054249279488,neutral,They follow up atpm Friday with a FOX News Reporting going after Planned Parenthood
3043,639404336506732545,neutral,anchoring special on the Planned Parenthood swirl tomorrow night talk with her today at 
3044,639422350056775681,negative,STOP THE SLANDER AND LIES ABOUT PLANNED PARENTHOOD Arizona at Work is on the air Thursdaypm MST AZ time 
3045,639443548987912192,neutral,Thank you for producing a special on the Planned Parenthood fetal body part scandal to be aired tomorrow night PPSellsBabyParts
3046,639451102291886084,negative,st he disallows use of Global Warming nowgtGovernors office scrubs press release on Planned Parenthood via 
3047,639544264226029568,positive,Hoping your tweet means u realize the importance of Planned Parenthood in early cancer screening for women Do you  
3048,639591078882971648,neutral,Tomorrow Ill respond to the oftenrepeated Abortions are only of what Planned Parenthood does ProtestPP
3049,639592214868262912,negative,Satan worshipers align with Planned Parenthood to defend the practice of chopping up babies for profit 
3050,639648980847198208,negative,An expose on what is REALLY going on at Planned Parenthood See for yourself Friday at pm PST on FoxNews 
3051,639775480812408832,negative,Please Watch Fox Newspm central tonight Friday to see what Planned Parenthood is doing with with Millions of our  tax dollars
3052,639791469293912064,negative,Sure they did How heinous and barbaric and yet the democrats stand with PLanned Parenthood rather than BABIES 
3053,639822276595068928,negative,Everytime my mom calls me I answer with Thank you for calling Planned Parenthood this is Karen how may I help you abort your child today
3054,639883122352500736,neutral,A federal terrorism task force is investigating the fire at Planned Parenthood in Pullman 
3055,639890066291195904,negative,Americas Killing Factory A look behind the walls of Planned Parenthood  Coming Monday Septemberth pm  
3056,639890137460146180,negative,get the facts on Planned Parenthood from the conservative media I didnt know it was funny Friday
3057,640123333070200833,negative,The fire may keep the clinic closed a month or more Planned Parenthood spokeswomanorg looking for a temp office  Devils hate fire  
3058,640177056119169024,neutral,Every Sat I pass people protesting Planned Parenthood on my way to work amp it makes me determined to donate more to them every fucking time
3059,640188972551897088,negative,There are no suspects yet in the arson fire at the Planned Parenthood building in Pullman It was ruled arson after an investigation Friday
3060,640281963920658432,negative,If youre dumb enough to believe the Planned Parenthood sting videos you are complicit in burning an office 
3062,640540480007241728,negative,Democrats will say BlackLivesMatter as they march you right up to the doorstep of Planned Parenthood 
3063,640594355649146880,negative,PLANNED PARENTHOOD is the focus of something others like say maybe church based hospitals may be doing  the market did not birth with them
3064,640774497075863553,neutral,PolitiFact Sheet things to know about the Planned Parenthood controversy via 
3065,641267197667639297,negative,MT Myst read of the day from Congress returns to tight deadlines key farts on Iran deal Planned Parenthood
3066,641304720326328321,positive,Planned Parenthood Continues to Stand Strong by Meagan Gallagher On July a group calling itself the Centers 
3067,641328490432884740,neutral,You can tell Joy Behar is back on the viewdefending Planned Parenthoodsaying only of their business is abortion relatedcmon man
3068,641356738369708033,neutral,Going to shut the govt down over Planned Parenthood Tom 
3069,641367336553984000,neutral,Whats behind the attacks on Planned Parenthood NEW SHOW Thurspm Sunsara Taylor SisterSong statement more 
3070,641450656583127040,neutral,Going to Planned Parenthood on Monday because I havent gotten a basic physical in two years I am writing a piece on it for Affinity
3071,641581327435866112,neutral,The US Justice Department sided with Planned Parenthood in its court battle with Louisiana Gov Bobby Jindal R Monday night telling a
3072,641587685942009856,negative,Congress will hold its first hearing on the Planned Parenthood controversy Guess who wasnt invited to testify 
3073,641617694652006400,negative,While not fantastic for Planned Parenthood those calling for defunding arent being honest about deceptive videos 
3074,641625870763999232,negative,LIVE Im atst hearing on the callous videos of Planned Parenthoods alleged abortion practices 
3075,641635092570488832,negative,That awkward moment when the GOP puts Planned Parenthhod on trial without letting Planned Parenthood defend itself 
3076,641669938588086272,negative,may God bless you in your fight against Planned Parenthood Shutting down government would make sure women never get healthcare
3077,641138999617187840,positive,Seriously reminder that the Pope is no figurehead  He is the leader of the Catholic Church  He has real power limited though it may be
3078,641150602240593920,neutral,DAILY POST POPE reveals why he likes UHURU so much See what he told WAMALWA OBAMA may faint 
3079,641156889666035712,negative,Even the Pope thinks Cameron is a douche 
3080,641162416139558913,negative,The pope is being a bae again but I feel like the Catholic church could be giving more to relevant charities 
3081,641171086944694272,negative,Even when the Pope says something nice he is saying something rotten 
3082,641173711148744704,neutral,Cross Wires Tuesday headlines Popes Motu Proprio changes the way Catholics get annulments Catholic parishes 
3083,641176871145635840,negative,Hey the Pope missed your communique on just looking after the Christians  
3084,641184028490645504,positive,Love the combination of pics here Pope at the gate about to be released into the wild 
3085,641188082625044480,neutral,The Pope and Mussolini The Secret History of Pius XI and the Rise of Fascism in Europe review  Books  The Guardian 
3086,641205630599057408,neutral,Good Tuesday morning Big news out of the Vatican  Pope radically reforms Catholic Churchs process for annulling marriages 
3087,641210593794465792,negative,in similarly shocking news the sun is hot and the Pope is Catholic Cant believe there is anyone who trusts this woman
3088,641211344524460032,neutral,Beginning today at noon tickets will be available to the public for the Popes event on Saturday 
3089,641213495422259200,neutral, TeamVillanosFDL  Pope to make annulment changes Pope Francis is expected to announce revisions on Tuesday 
3090,641216724180709376,positive,Tickets to see the Pope go on sale today at noon  The rest go on sale tomorrow  Heres the link and all the info 
3091,641227698111574016,positive,This radical Pope is close to getting excommunicated  May the Force be with you always  
3092,641230963444465664,positive,DE LABORE SOLIS  He is the last Pope for the Prophecy  The Sun amp OUR Gods come back  
3093,641231945121185792,positive,KCCI Pope changes annulment process for divorced Pope Francis on Tuesday radically reformed the process by  
3094,641234323245412352,neutral,obama amp the pope are everywhere theyre getting everyone accustomed to seeing their faces everywhere when sunday law comes itll be normal
3096,641236215866490880,neutral,Life long Catholic but some of rules nonsensical  Remember Venial sin no meat on Fridays So I dont worry about Pope
3097,641238799599706112,negative,  And now the Pope who has forgiven annulments   I think his words were fuck and be fucked   I may have translated that wrong
3098,641240062118756352,positive,December begins the Popes year of mercy
3100,641249773928980480,positive,This pope is so cool I may just remake my MySpace so I can add him to my top
3101,641250877391695872,negative,Anyone else feel like Cool Pope may be in jeopardy of going down Julius Caesarstyle
3102,641250940218142720,neutral,We understand that the site should reopen next Tues Popes Urn will be officially launched by Lord True on Mon Sept
3103,641252712194179072,positive,Families take in refugees as Pope calls on Europes churches to open their doors st X I disagree with his Holiness
3104,641253026188144640,negative,Are they closing all schools the Pope visit or the Million man march anniversary Foolishness 
3105,641257580455665664,positive,Cmon do you wanna popular pope or a strong spiritual leader Popularity and the Pope catholic popefrancis
3107,641261535067770880,neutral,The Pope may get applause but it is actually another eg of the church being pulled along by modernity Still a long way to go
3108,641266192057896960,neutral,Pope simplifies Catholic marriage annulment Pope Francis making the most substantial changes to Catholic mar 
3109,641267403813449729,neutral,Re Pope is it possible to take MFL fromnd toth on MORNING of MONDAY Sept When does MFL resume regular schedstops
3110,641271370664443904,positive,Join the Moral March in Washington DC on September On September Pope Francis will address Congress on 
3111,641283483713728512,neutral,Tried to get Pope tickets but it sold out hotter than any concert  Will try tomorrow at noon
3112,641287967521263617,neutral,The Pope Wants To Make Annulling a Marriage Easier  Pope Francis on Tuesday revolutionized the procedure for Roma 
3113,641295790481231872,negative,It was just a matter of time This Popes day may be numbered as head of church gt Conservative dissent is cont 
3114,641298193871843328,neutral,Pope radically simplifies Catholic marriage annulment procedures VATICAN CITY Reuters  Pope Francis on Tuesday made it simpler an
3115,641304560162709504,positive,I just hope the You Only Pope Once pale ale doesnt go quite as fast in Cape May that weekend
3116,641308763308335104,neutral,World Popes faster annulment plan may mean less in US Pope Francis has just reformed t via 
3117,641312094567186436,neutral,Thanks pope Francis for quickie divorce VII stylend Council + Novus Ordo the work of Masonic infiltrators
3118,641312870786035716,neutral,Its been a hard days fishing  today myst fish a ruffe a good start I thought Id been blessed by the pope 
3119,641314853756510208,positive,call Hafiz saeed sir he may help u out Maybe Pope can b handy  Try it
3120,641317664384786436,positive,Celebrating the Pope What Makes Pope Francis Tick FREE webinar Septp EDT More info presents
3121,641323092208431104,positive,As a Jesuit Pope visits the US you may have questions about us Check out the US and Canada Jesuits resource page 
3122,641329554120908800,neutral,Pope Addresses Portugals Bishops onYearly Visit Pope Francis on Monday received in audience the bishops o 
3123,641330968587059201,neutral,Question Somebody settle this for me  when the pope comes in town the weekend of theth of 
3124,641331355687755776,positive,The Pope is only as nice as he has to be to lure you back in Cool Pope strikes again Pope Francis on Tuesday 
3125,641332059328397313,positive,Pope Francis USA tshirts on sale for  to Mr Hylkaroom by Thursdaypm These will be worn the day the pope arrives in the US
3126,641340308190400512,neutral,I wish the Pope would do ANYTHING other than canonize Serra when he visits my school on therd  I really like 
3127,641345098681225216,positive,Looks like I have a shot at getting tickets to the Popes Mass So if anyone isnt busy atEST tomorrow Id appreciate some help
3128,641346625059729408,positive,Pope Benedict XVIst to quit in about yrs feared a bad pope would be chosen  
3129,641352993003012097,positive,Hey everyone go vote so the POPE vs Woodstock game can be shown live on TV on Friday           
3130,641359485349441537,positive,Went on a tour of the Basilica where Michelangelo was buried Going to the Sistine Chapel tomorrow Pope is speaking there
3131,641359984568078336,negative,It was a Disrespectful Travestys for POTUS to send ProAborts Pelosi amp Biden to the Popes Installation 
3134,641368717570494464,positive,I am glad the Sanhedrin is back in business because of therd Temple and will be trying Obama and the Pope in absentia Well deserved
3135,641379710006611968,positive,If you missed out on Pope tix for Independence Halljust annnounced more tix avails onlineamppm Wed 
3136,641386039983128576,positive,LADY TECNIQ NEWS A Quick Pope Primer Things to Know Before His Historic Visit to the United States Later This Mon 
3137,641407191161765892,neutral,Popes faster annulment plan may not mean as much in the US 
3138,641408123404709889,positive,Today the Pope announced making it easy to get an annulment Coincidence that today is myth wedding anniversary omen wtf SignFromGod
3139,641412525930713088,neutral,Sen Schumer to announce Wednesday the winners of tickets to see Pope 
3140,641415505509773312,positive,WISCTV_News Popes marriage annulment changes expected to make church more inclusive news  
3144,641433386221830144,positive,We just had a great time with Joyce Coronel with The Catholic Sun  She interviewed several families who are going to see the Pope
3145,641436136515112961,neutral,Whats going on Tickets for pope Mass available Wednesday  The News Journal Get found gt 
3147,641439816933093380,positive,I wonder if the Pope watches our games  may be the quote of the season
3148,641440505943998464,neutral,My Jesuit university sent out an email saying the Pope will be giving mass at Madison Square Garden on Septemberth Starts at
3149,641448032014336000,neutral,so you balance out an American hero with a  woman beater Whos on tomorrow the pope and OJ
3150,641475702513102848,neutral,Is the Pope a Catholic Do they drive PU trucks in Alberta 
3152,641504331305455616,positive,Religions power is not in becoming more like you but in showing you an ideal to copy So while many may like the popes changesas an 
3153,641511801696464896,neutral,The Pope is way advanced than the century self hes probably inrd LMAO
3154,641512160649019392,neutral,Pope says marriage annulment should be free new rules may mean marriages can be annulled in just days in some cases
3155,641541239666442240,positive,so the pope visit the philippines somewhere in january
3156,641552481403674624,positive,Better call the Pope He may be more sympathetic one never knows
3157,641557033238556672,positive,Hope the Pope heard about it  
3158,641562494461456384,positive,September  CERN Pope meets congress for the first time ever Yall betta wake up Its bout to go down  
3159,641578663096401921,positive,The Pope is coming amp ourst graders are learning about his travels with Flat Francis Mrs Donohue youre awesome 
3160,641579926215266304,positive,Serbian President to Visit Pope Francis on Friday Serbian President Tomislav Nikolic will meet with Pope Fran 
3161,641581847084957696,negative,like how are ppl supposed to pay rent Should i ask the pope on theth when he comes
3162,641605895873363968,positive,Focus on Faith and Climate Change Pope Francis amp theth era of the Catholic Churchs engagement wscience Premium
3163,641609830575157248,neutral,More confusion from Francis the First Merciful Pope 
3164,641612134237929472,positive,Pope to make historic US Congress address on Sept  News  
3166,641612833893908480,positive,Pope concelebrates Mass with Armenian Patriarch History was made on Monday when Pope Francis concelebrated mo 
3167,641616155619258368,neutral,Skimmed it  May not LIKE the SCOTUS decision but its THE LAW No offense but your Pope Climate Change seriously 
3168,641625265542688768,neutral,oh there UE Monday ok I wonder what days well have cause of the Pope
3169,641631024808656896,positive,The LittleKnownth C Marriage Crisis amp the Great Pope Who Stood Firm  ChurchPOP 
3171,641643033134563328,positive,The Pope RSVPd Have you Take your selfie with the popup Pope at our Fall Social on Monday 
3172,641643922549288960,neutral,The theologians of the Church teach that the See may be vacant at the death or resignation of a Pope until a new one is elected
3173,641649333440499712,positive,tbh I may be even more excited about the Popes joint session with The US Congress than his public appearance Mass in philly
3174,641652726309502976,neutral,How the popes personal experience with annulments may have led to reforms via 
3175,641655938315894784,positive,Come say hello this Saturday at Founders Day Just look for the Pope 
3176,641657524609904640,negative,We just got an email warning us that THE POPE IS COMING in two weeks The next email said that BIEBER IS COMING tomorrow ACK
3177,626083470415134721,positive,Pride Parade  join the festivities this Sunday happening in the West End frompm 
3178,626130101478948864,positive,Embrace community diversity amp unity once again as the Pride Parade celebrates its existence for years this Sunday 
3179,626380716587266048,neutral,Find out about road closures on Saturday amp Sunday August due to Pride Parade amp Village Street Party at Brighton
3180,626461225405313024,neutral,btw from one gay babe to another what do u think i should wear to pride parade on saturday itll probably be raining but
3181,626472966235271168,neutral,I couldnt get Aug off Im so sad I really wanted to go to the pride parade
3182,626510385584177152,positive,In case you missed it or want to look for yourself last Sundaysst annual LdnOnt Pride Parade airs at pm tonight on Rogers TV
3183,626678338862497792,positive,Ill be joining in Vancouvers Pride Parade Sunday Walk with us burnaby vanpride lpc
3184,626733015495016448,positive,Bus services in Liverpool city centre will be affected on Saturday due to the Pride Parade 
3185,626751345903558656,positive,There better be a cold beer waiting for me at the finish line to the Pride Parade on Sunday thisisnotajoketweet
3186,626784786057678849,positive,SOGIC and LawyersWithPride are getting ready for the Pride Parade in Vancouver this Sunday Hope to see you there 
3187,626849425940459520,neutral,As much as I love Pride Parade you may have a point Jamaica isnt ready yet  
3188,626864737574326272,neutral,Jerusalem should have its next pride parade on Saturday  Cant cut people on the Sabbath
3189,626894920658350080,positive,ooh i should totally wear my fnatic tshirt to pride parade on saturday since its all pink n cute heh
3190,626905665563414530,positive,Its going to be a BIG weekend Pride parade official Patio Day amp a holiday Monday Check out out hoursgt 
3192,627001918305406976,neutral,YVR I need to find a wagon to borrow for the pride parade on Sunday Red flyer folding camp wagon etc Something to hold a cooler Halp
3193,627040267166744576,positive,Check out this awesome Cadillac De Ville that LINC will have for the Pride Parade on Sunday Very kindly 
3194,627104379917737984,positive,Ready for the Pride Parade on Sunday Heres the route so you can plan ahead PEAKMornings 
3195,627153671617413120,positive,I invite you to join me at the Pride Parade tomorrow We will be meeting in the Provincial Government parking lot atpm See you there
3196,627153843147702273,neutral,We add our regrets for yesterdays tragedy at the Pride Parade May Peace Happen during our time  Shabbat Shalimar  
3197,627181155679358976,positive,Samson Odin Thor Caesar have just arrived in Brighton to assist local officers with the Pride Parade tomorrow  PS 
3198,627186040055296000,positive,Good luck Thor SamsomOdin and Ceasar  Do the Mounties proud May tomorrows Pride Parade be a big success
3199,627227414918094848,positive,Good times  We are gearing up for the Pride Parade on Sunday  Come out and cheer us on Will be a great day 
3200,627264155607674880,positive,Diversity is a beautiful thing Watch for the burnabyschools float in Sundays PRIDE Parade 
3201,627398469448298496,positive,Today its the Pride Parade in Stockholm Its been raining the whole summer here but today sun is shining Because love is shining
3202,627544225278754816,positive,Such a brilliant day in buzzing Brighton Pride parade sun and beach Just wish and could have enjoyed it avec moi
3203,627559058388709383,positive,Pride parade outcome Lots of fun a heavy sun burn and back pain Wish I could party tonight but packing for GDCGamescom takes priority
3204,627607112269459456,positive,Join us at our pride picnic this Mon Augrd atpm the day after Pride Parade   Vancouver 
3205,627648889244422144,neutral,Due to the Pride Parade tomorrow the Free Shuttle will not pick up for the entire day Pls go to Vancouver
3206,627682318484832256,positive,Thanks for RT my dear By the way If you hear noise from the West its just this Sundays Pride Parade in Vancouver 
3207,627687854089609217,neutral,Look for me tomorrow with the and at Vancouvers Pride Parade 
3208,627841613394526208,negative,Horrible news The yo girl stabbed at the Pride Parade on Thursday died of her wounds BDE
3209,627843051856203777,negative,The worst the girl stabbed in the Pride parade has died   
3210,627856829670752256,positive,We will have to wait to hear from LPC ldr he is en route to Vancouver to march in the Pride Parade today cdnpoli
3212,627992113653792768,neutral,Photos Pride Parade in Vancouver Hundreds of thousands took to the streets Sunday in downtown Vancouver for  
3214,628037882523947008,positive,Video Pride Parade Vancouver Theth Annual Vancouver Pride Parade filled the streets of Vancouver Sunday  
3215,628540752289730560,positive,My wife is a devout Christian and she went to the Pride Parade on Sat and loved it
3216,628599397748707329,positive,The Pride Festival starts soon in CapeBreton Join the labour movement Saturday at the Pride Parade CBpoli canlab 
3217,628644381738835968,neutral,Close to people packed into Vancouvers West End Sunday afternoon to celebrate theth annual Pride Parade 
3218,628670372343189504,neutral,Sunday at the Pride Paradeby the look on his face Justin was just not ready
3219,629311671979352064,positive,woo my film is all ready for the exhibition Should be a super busy day on Sat Exhibition Pride parade fetish meet up and partying
3220,629716382553223169,neutral,March with in Clevelands Pride Parade tomorrow  
3221,629721843872698368,positive,Watch the Pride Parade live from Reykjavik on our web camera on theth of August atPM 
3222,630027162901442560,positive,We want your beautiful face in a photo w PeaceCar at the Pride Parade in Madison Sunday pride 
3223,630068484341272576,positive,Sunday is Pride Day Come tomorrow to to see Pride Parade and enjoy the day with exciting entertainment 
3224,630082111400214528,positive,Thanks for retweeting On the road home from summer holidays Back in Fredericton tomorrow and Ill be at the Pride Parade
3225,630098835532943360,positive,Meet up at Starbucks by the Capitol around tomorrow morning Clipboarding before the PRIDE parade
3226,630660065654099968,positive,The Dementia Community Roadshow vehicle will join Manchesters pride parade on Saturday August for the first time 
3228,630884316508200960,neutral,lola Vancouvers Pride Parade  Sun Protection  HereInVancouver has added a photo to the pool 
3229,632197817000402945,neutral,Some of our services will be affected tomorrow in Cardiff due to the Pride parade full details here 
3231,633325501889802240,positive,We will be walking in the Pride Parade on Saturday parade starts atpm  at FoundryMain St Let us know if you 
3232,633353657648480257,neutral,Ill be working Saturday but hope to watch the pride parade on Sunday canqueer ottawa
3235,634704389513584640,neutral,Are you attending the Pride Parade this weekend Join our float and march with us CapitalPride 
3236,634900294728609792,positive,Need something to do tomorrow Why not celebrate Pride with us by attending the Pride Parade Start time ispm 
3237,634985670914633728,neutral,Gay rights advocates say conservatives need to walk the talk not just march in Pride parade 
3238,635178479227502592,neutral,Pride Parade will take place in the downtown core tomorrow starting atpm Find out which roads are affected here 
