,Id,Category,Tweet
1518,639526046732124160,positive,and when I go to see Madonna in march Im going to pretend its really you up on stage Ill never forget u Ellen
1519,639543984914866176,neutral,On September Madonnas first album debuted at  on the Billboard Top Albums Chart in the USA The 
1520,639550944674480132,neutral,There is a rumor going around that Madonnas new single will be released tomorrow Dont believe in this lie
1521,639694851542532096,positive,Its Friday and the end of a short weekResult Lets celebrate with and Madonna afteram this morning Dave amp Heidi x
1522,639718467617357824,positive,Listening to old school Madonna before heading out for a Friday night in Brisbane with a mad Italian cherish Madonna
1523,639760084705386496,positive,On September Madonna performed Causing A Commotion live via satellite from the Stadio Communale in Turin 
1524,639855558170968064,positive,You can resort to the old Madonna hit HolidayCalibrateif need be That may have predated you however
1525,639884524038553600,positive,On September there will be a blessing of CLC at thepm Mass in Madonna della Strada All are welcome See you there
1526,639906461800361986,positive,On September Madonnas The Immaculate Collection won Best LongForm Video at theth annual MTV Video 
1527,639906464614739972,positive,On September Madonnas fifth single taken from her Erotica album Rain moved to  on the Billboard Hot 
1528,639913868265922562,positive,Sunday were striking a pose with Madonnarama Join for an all Madonna dance party til am 
1529,639982680692625408,neutral,I wonder why Drake didnt release thend verse on Madonna all at once I think its better than the first one
1530,640018785496207360,neutral,L L Madonna In the Beginning Gravity by Madonna CD Aug Gravity USA Celebrity Buzz 
1531,640037120623673344,neutral,So what if Madonna thought BTW was reductive Is she not allowed to have an opinion or be honest 
1532,640165933730934784,neutral,Weird Madonna concert dreams this morning Speaking of I have extra tickets Let me know if youre interested September MSG
1533,640170929964883968,positive,Your Saturday Satisfaction with Madonna  Dont Cry For Me Argentina smusic top
1535,640235912023175168,neutral,April Madonna performs Like A Virgin on The Virgin Tour in Costa Mesa at the Pacific Amphitheatre 
1536,640237892539940864,neutral,Ayd screen pass TD makes it Tusky over Madonna early in therd Scoreboard powered by 
1538,640377108016050176,positive,Ready to see Madonna on theth
1539,640389442503618560,negative,She has the right to disagree I hate Madonna But dont think she should be stopped singing her shitty songsst amendment bro
1540,640395760073224192,neutral,This is such a breach of thest amend that EVEN Madonnas GAY brother is standing with KIM Const attacktd
1541,640508164258033664,neutral,Its on Madonnas Facebook page hun If you dont have Facebook its also here 
1542,640619215792140288,neutral,On September Madonna performed Express Yourself  at theth annual MTV Video Music Awards at the 
1543,640705457070456833,positive,Is anyone trying to go with me on Septemberth to see Madonna
1544,640733250776879104,positive,Yes it impressed me I was there in person last September almost exactly one year agoThe Madonna is huge so beautiful
1545,640733666096779264,positive,Pic of what I got to experience Friday Before the entire world get to see it  D Madonna performing Dress You Up 
1546,640749840448618496,positive,Secret may sound like a love song but its really about spirituality and selfempowerment Its about God being in all of us  Madonna
1547,640798208784998400,positive,Going to see Foo Fighters in Edinburgh tomorrow night but for now its Madonna on Spotify shuffle
1548,640821894283952128,positive,Gonna listen to Madonna all day until nov RebelHeartTour prague
1549,640892651177426944,positive,Book now la cala this saturday is madonna tribute night back to thes mssanget and my dancers will will be 
1550,640907768325611520,neutral,Why did no one tell me Madonna is going to be at the Verizon center on Friday
1551,640918530041507840,positive,Im gunna look exactly like madonna tomorrow at the fashion show
1552,640930126981672960,positive,On the phone to HMRC who asked myst name then said Do you have a second name Tempted to say nolike Rihanna Madonna etcjust name
1553,640942177170800640,neutral,Nope Still halfasleep More dancing Seems like a Madonna sort of Monday so on with a Bonus Song of the Day  
1554,640957838693679104,positive,This is the wave + the sun in one symbol  This is the symbol for Batman  I got the symbol for Madonna because she saved my life
1555,640959801892163584,neutral,Madonnas albums may flop but she can still gross high from a tour nowadays
1556,641010229270958080,positive,Nick are you going to see Madonna on this tour Im going on September in Chicago I cant wait
1557,641159289994809344,neutral,Madonna will make her first appearance in Hong Kong on Februaryth at AsiaWorld Arena
1558,641206306720870400,positive,TRUE BLUE by MADONNA was no in the UK album charts on September
1559,641210188675084289,positive,May the angels protect you and sadness forget you  Madonna Little Star songlyrics
1560,641220766877511680,positive,Just one more day to go gtgt Madonnas Rebel Heart Tour starts tomorrow What to expect 
1561,641231953027596290,positive,anytime  this week they r giving away Madonna tickets too if you wanted to try to get in for that show for Saturday too
1563,641238282546868225,positive,Sure jan the queen is Madonna and always will be Get the fuck over it  
1564,641251482474577920,positive,Tomorrow iss day and I dont wanna be the basic Madonna but iTS ALL I HAVE WHY THES WHY NOTS
1566,641299887829708800,neutral,If it keeps making money for HBO they may have to start going to former colonies as well Or even have to take Madonna
1567,641323736982007808,positive,I have to decide am I going to go to a Madonna concert on Saturday Could be interesting Thats gotta be a hour show right
1568,641327838566682624,neutral,Why did you keep Madonnath in that grossly inaccurate tweet AskMusicNews_Facts
1569,641365936851673088,neutral,A primer on Madonnas Rebel Heart Tour The tour kicks off at the Bell Centre on Wednesday and Thursday 
1570,641378155328991233,negative,the poor things are so jaded  Nobody cares about gags Madonna is going to shit on her premiere tomorrow
1571,641393021104324608,negative,Oh So bummed has no rooms avail on theth Where the heck am I supposed to stay when I see Madonna
1572,641400169574105088,positive,nah m always start at the beginning and see the evolution madonnasnd andrd albums are perf
1573,641448902596653056,positive,Just got Madonna tickets for thend night at MSG for myself and  Matthew CarlBrucker Toles  which means 
1575,641468343342514176,neutral,Paula first plans shootst vid w Leo Madonna advises begin with a solo Babydoll is shot b Showgirls 
1576,641469648677027840,positive,Warning prepare for many Madonna tweets tomorrow since it will be the opening night of the RebelHeartTour whosthatgirl
1577,641479883730714625,positive,I going on theth hope to find it hope you guys to good luck to all of us Madonna fans
1578,641482474174984192,positive,This is thest tour that Ive had Madonna tattoos for Wonder why it was RebelHeart to make this happen RebelHeartTour
1579,641489396970029058,positive,Great what a cutie and it was nice to see your face on there omg Madonna coming back on stagest time I am on the internet
1581,641508814341074944,positive,in Madonnasth year she earned million Back then it was really expensive 
1582,641529631615680513,positive,A break from all the disasters around the world Cant wait to see Madonna on Sat and be a teenager again 
1583,641555369286832128,negative,Just until theth or some shit I dont want to see Madonna spoilers
1584,641613817059876865,neutral,depending on how late Madonna goes on stage tonight I may consider thinking about getting a ticket for Sat night  maybe  notreally
1585,641645675353014272,positive,Totally called it Bitch Im Madonna is thend song
1586,622462883994161152,positive, July The last films of the evening are AntMan A and Magic Mike XXL  Both films startpm sharp
1587,622515915595366400,positive,Going to see Magic Mike XXL may be the single best decision I have ever made in my life
1588,622546592600596480,positive,In theater to see Magic Mike XXL for therd times Love this movie
1589,622580048038596608,positive,Sundays heating up like its summer all over again Make MattBomer your Sundate with MAGIC MIKE XXL  now 
1590,622582169345634304,positive,Seeing Magic Mike XXL with my mains last Friday fridayfunday unforgettable tgifholiday 
1591,622715323423133696,positive,I may not seem like the target demographic but let me tell u that I think Magic Mike XXL is one of the most excellent pieces of film making
1592,622730312175390720,positive,Magic Mike XXL is better than thest I learned a lot about the male stripper psyche amp culture amp midlife crisis amp female sexual desire
1593,622775200149569537,positive,Yes Magic Mike XXL is a feminist movie but the reason may surprise you 
1594,622909601139200000,positive,A FB friend of mine just posted that seeing Magic Mike XXL was the best night of her life If only she knew what my typical sat night is
1595,622998426943422464,positive,What is this force that compels me to keep watching Magic Mike XXL Saw it thend time yesterday and am already ready to see it again
1596,623018843489857536,positive,Also ace time with the uni ladies Saturday in Stonehaven barbeque Magic Mike XXL tons of food hips hurt from all the walking though
1597,623132683506352128,negative,Mama Shoti i bought tickets to a movie the title is MAGIC MIKE XXL i dont know why is that the but watch it with me tomorrow Me
1598,623200363387224064,positive,I want Magic Mike XXL  Cmon   hoorayformonday workwork nachos lavinia novaturient
1599,623316890996248576,positive,Magic Mike XXL on a Monday nightwas everything I expected it to be
1600,623322358829297664,neutral,So Magic Mike XXL is out of theaters as of last Friday in the Bahamas A whopping three weeks to the day of release
1601,623328721244684288,positive,rd times a charm after seeing Magic Mike XXL for the third time
1602,623428903189782528,positive,Hey how about august electric scream screening of magic mike xxl Mamas def want to see some dancing and comedy
1603,623476592812163072,positive,Woop Cant wait to see Magic Mike XXL this Friday with the girls 
1604,623493553122082817,neutral,To make room for the new movies MAGIC MIKE XXLs last showing is WEDS THE GALLOWS INSIDE OUT amp JURASSIC WORLDs last showings are THURS
1605,623703521733390337,negative,B texted me and told me that she amp her mom went to see Magic Mike XXL she loved thest one and she hated it
1606,623708530831331332,positive,Going to bed cant wait to see for myself the antihetero male campaign that Magic Mike XXL is apparently leading tomorrow  Goodnight
1607,623741601534210048,positive,Here he comes ladies Magic Mike XXL will be getting it all off TOMORROW night for the Otautau Plunket 
1609,623845531421380608,positive,Lol just spent an hour talking to my mum about Magic Mike XXL I was sposed to work today amp take tomorrow off but meh Im gonna reverse it
1610,623901546158379008,neutral,I have surgery inside my face tomorrow so stockpiling good feelings by going to the cinema with to see Magic Mike XXL   A+
1611,623975982181945344,positive,Im taking my womens networking group to see Magic Mike XXL tomorrow and many of them are over so this is going to be a good time
1612,624164885384007680,positive,rd viewing of Magic Mike XXL tonight What a time to be alive to have this chance to live my best life
1613,624393060252696576,neutral,Who will go see Magic Mike Xxl with me before I leave on thest
1614,624401907918970880,neutral,sister accidentally saw Magic Mike XXL with our mom amp wont take a break from texting how horrified she was to say how it compares to thest
1615,624419598658600960,positive,Dear all people I know who are attracted to men  Go see Magic Mike XXL  Fair warning  you may fall madly in love with Matt Bomer swoon
1616,624513503655784448,positive,Whoever took their baby to thepm Friday screening of Magic Mike XXL youre my hero
1617,624697156230889472,negative,Magic Mike XXL is probably the single cringiest film Ive ever sat through at the cinema
1618,624764838212861952,positive,Magic Mike XXL was the perfect warm up for tomorrow nights entertainment
1619,624825126576484352,positive,I approve not of the rough day May I recommend a viewing of Magic Mike XXL to cheer you up
1620,624964022257913856,positive,I think sitting on the veryst row watching Magic Mike XXL was the BEST idea ever
1621,625009089722974208,positive,May or may not be going to see Magic Mike XXL for the second time tonight gtgt noshame
1622,625111128708792320,positive,Magic Mike XXL is so muj better than thest one lol
1623,625148177100902400,neutral,k on the Feminism of Magic Mike XXL due on my desk tomorrow
1624,625322593160175617,positive,Im going to see magic Mike xxl I think thats what its called this Tuesday with two friends its a movie with Channing Tatum lt
1626,625463703987724288,positive,I hadnt seen cry until today at ourpm showing of Magic Mike XXL was myrd time seeing it amp I would again
1628,625606066240401409,neutral,nobody wants to see you panting in the shadows over Magic Mike XXL atpm on a Monday
1631,626072997087068160,positive,Goddess bless the Sisterhood of Seeing Magic Mike XXL Alone atpm on Tuesday
1632,626270491888721920,positive,Going see Magic Mike XXL for theth time tomorrow  After watching this scene no explanations needed GOOD NITE 
1633,626320286594560000,positive,A select person keeps reblogging certain set pieces from Magic Mike XXL onto my tumblr dash Sis SISTER May God bless and keep you
1634,626441817509072896,positive,We saw Magic Mike XXL on a Tuesday night after eating Vietnamese sandwiches and gossiping about comics things
1635,626611558009843712,positive,Magic Mike XXL was even better thend time
1636,626614469452505088,positive,I have to say the Pony scene from Magic Mike XXL may be some of Channings finest dancing
1637,626723970314862592,positive,Living for Magic Mike XXL with tomorrow
1638,626815401242963969,positive,I may be the last human on Earth to see Magic Mike XXL but tonight its happening
1639,627004854850842624,positive,Magic Mike XXL and the pursuit of pleasure  The Daily Collegian   BackstreetBoys
1640,627040472746168320,positive,My weekend plans Play Fallout see Magic Mike XXL with my sister amp DampD on Sunday What are everyone elses plans
1641,627147203614744576,positive,July Aug MAX PG amp MAGIC MIKE XXL R Mark your calendar now for the Labor Day weekend Dbl DusktoDawn You wont want to miss it
1642,627193525218770944,positive,Magic Mike XXL is going to be hilarious tomorrow 
1643,627348725036285952,positive,I think Ill go watch Magic Mike XXL at the theatre again tomorrow Im in that kind of mood I need me some male stripper action
1644,627708805313212417,positive,Magic Mike XXL may be my favorite movie of the summer I was smiling and laughing the entire time
1645,627762044003991552,positive,You bet your bottom dollar I saw Magic Mike XXL for thend time tonight and loved every minute of it
1646,627979005317091328,positive,Busy week Tues  Love and Information Wed  Ghost Stories Thurs  Matilda and tonight MAGIC MIKE XXL
1647,628042502654660609,positive,Sunday funday is lunch and Magic Mike XXL with the ladies then swimming Channingishot gimme
1648,628327427392020482,positive,Burgers ales wine Magic Mike XXL Way to make Monday bearable magicmikexxl
1649,628494427292504064,positive,Abs Dancing Dudes Get along to MAGIC MIKE XXL at the this Thursday atpm 
1650,628882024586190848,positive,So Magic Mike with was super great Tomorrow Im going to see Mission Impossible but all I wanna do is watch Magic Mike XXL
1652,629120912374296576,positive,Ladies night out On Augustth Wileys is hosting a Male Revue with members of the new Magic Mike XXL Watch 
1653,629345294266859520,positive,For the ladies because Thursday Donald Glover in Magic Mike XXL Tasty 
1654,629764521561849856,positive,Bit late to the party but just back from Magic Mike XXL and ermahgaaad I could have sat in that cinema for the rest of my life Nom nom nom
1655,629819019026010112,positive,Nothing better than listening to the Magic Mike XXL soundtrack on a Saturday ChanningSwag DemBeats
1656,629954659097014272,neutral,Sitting at home on a Saturday night watching Magic Mike XXL in bed with my dog and a pizza box wondering why Im still single
1657,630273340133937152,positive,HAPPY BIRTHDAY GORGEOUS May you day be more magical than the movie Magic Mike XXL p
1658,631911895763689473,neutral,Would it be wrong to watch Magic Mike XXL for and time
1659,632145459637821440,neutral,I think they may have used up all the sexy earlier in the summer with MAGIC MIKE XXL
1660,632240200056369152,negative,One of my Magic Mike XXL coworkers and the coordinator of the premiere I went to on June this year died 
1661,633094920014839808,positive,then you may like the Magic Mike XXL soundtrack
1662,633463250563280897,positive,New movies starting Fri  How to make Love Like an Englishman  Magic Mike XXL  movies  Montreal
1663,633899276314279936,positive,Magic Mike XXL comes out on DVD in October  so someone has to buy it as a birthday present for me lol
1664,634171544298721280,positive,Andi does Shes also seen Magic Mike XXL like times though so you may just have to be your own judge
1665,635610705761275904,positive,So I get to go see the Magic Mike XXL live show this Friday Im in heaven
1666,636305411918860288,positive,This Friday We are showing the film Magic Mike XXL in Chem for FREE at PM 
1667,636400724021121024,positive,We have an encore screening of Magic Mike XXL this Thursday at pm at Rainbow Cinemas You dont want to miss 
1668,636572711674884096,positive,prolly not  Magic Mike XXL comes out on Septemberth and thats gonna keep me hetero through the holidays LOL
1669,637198427487518720,neutral,fell asleep during Magic Mike XXLguess we are just gonna have to rewatch it tomorrowdaaaarn
1670,637265887238578176,positive,The Modern Family star and her Magic Mike XXL hunk are said to be tying the knot in November
1671,637381848348409857,positive,Magic Mike XXLwellll boyyyyyyit was way better than thest
1672,637740713610887168,positive,Barely watching Magic Mike XXL for thend time
1673,638068508451061760,positive,London Spent the afternoon with friends in Soho hotel enjoying our time together Sunday cinema Magic Mike XXL OMG 
1674,638120614549520385,positive,So I may have disturbed some of the other filmgoers at MAGIC MIKE XXL when I squealed just a bit at scene
1675,638121330840346624,positive,Cineplex is doing Tuesday prices every day until September someone come with me to see Magic Mike XXL
1676,638127140534226944,positive,Dollar Theatre  Its Sunday night what else am I gonna do Anyone wanna see Magic Mike XXL with me  Ha
1677,638168995271737344,negative,I was SO disappointed with Magic Mike XXL If it would have came out first I dont think I would have watched thend one
1678,638339164145123329,positive,Attention Queens I finally found a good copy of Magic Mike XXL so I will be watching it ard andth time with whoever hasnt seen it yet
1679,638621595624312833,positive,Magic Mike XXLth time If you think its just about strippingyou would be wrongYOURbeautyisenough
1680,638829173469900800,positive,Yep its happening Come watch Magic Mike XXL this Friday atpm and start your Labor Weekend off right 
1681,639184399062294528,positive,Magic Mike XXL is still playing the awesome Simi Valley bargain house but the run ends Thursday 
1682,639243526539227136,positive,In the spirit of sharing WORLD OF TOMORROW MAD MAX FURY ROAD TANGERINE MAGIC MIKE XXL BUZZARD EX MACHINA
1683,639482744179822593,positive,Im rewatching the Cheetos and Water part from Magic Mike XXL for therd time lol
1684,640743490196893696,positive,Im mind blown after watching Magic Mike XXL for thest time
1685,641069286371430401,positive,bout to watch magic Mike XXL for theth time
1686,629422725996630016,positive,Mariah Carey Celebrates Her Star with Beachers Madhouses Jeff Beacher via 
1687,629486615396683776,positive,So Im on the juke box at the flats and I decided to play all I want for Christmas by Mariah Carey Its AugustLets see how this one goes
1688,629650159299751938,neutral,For sure just Missed my exit because was singing to Mariah Carey way too full out Happy Friday all
1689,629754921873752064,positive,Mariah Careys Twins Hilariously Stole the Show at Their Moms Walk of Fame Ceremony  Fox News Insider 
1690,629799095264096256,negative,Saturday I saw you holding hands with someone new That part does something to my soul Circles by Mariah Carey
1691,629947925951586304,positive,This is what happens when you try to share Mariah Careys spotlight via 
1692,630059280784355328,positive,Dont let the sun go down  George Michael amp Elton John  One sweet day  Mariah Carey amp Boyz II men
1693,630098008500215808,positive,I may not like her music but Mariah Carey is the queen of shade I worship her
1694,630109141751611392,positive,The Mariah Carey amp Justin Bieber Collaboration Why You Mad Is HERE Listen How exciting On Saturday the Mariah Carey and Justin B
1695,630110231561814016,positive,HLWD is leading the pack for a Mariah Carey ride tomorrow at Grab a bike and end your weekend with a cardio party
1696,630155535300456448,positive,My shuffle is favoring Mariah Carey hardcore today but whatever its Saturday Im supposed to feel like a diva anyway
1697,630202391866966016,positive,working on Tinder profile in case husband ever leaves me  Strengthsst on the dance floor Efficient typists Mariah Carey lyrics
1698,630335982211072001,neutral,Game of TONESst question today on with   Who was Mariah Carey married too from Sony
1699,630449023439273984,positive,I have a genius idea for your face the sun video Think giant Mariah Carey fans color cortex and glory Lets work on this
1700,630751020465795072,neutral,Mariah Carey shows fuller frame in Malibu with twins Sunday  Daily Mail 
1701,630926947598516224,neutral,Mariah Careys Daughter Monroe Gets Her Ears Pierced  See the Pic via 
1702,631069808717660160,positive,sometimes you just need to obnoxiously sing along to mariah carey on a rainy tuesday morning
1703,631071375160119296,positive,Mariah Carey does it to hisnd marriage life I made a vow that i will reserve myself to the next one ill be 
1704,631119733488652288,positive,Mariah Careys Star on the Walk of Fame Its About Damn Time 
1705,631292975679688704,positive,Tuesday night apartment dance party feat duets w classic Mariah Carey tracks Spoiler alert I cant hit the high notes whistleregister
1706,631447128016068608,negative,Well its Augustth and Ive just heard Mariah Careys All I want for Christmasseriously
1707,631450050682572800,neutral,I dont either Complete mystery Also I may have just been chair dancing to Heartbreaker by Mariah Carey
1709,631647796496457728,negative,Are you fucking stupid You cant talk about sales when Mariah Carey outsold bey with herrd album please stfu damn 
1710,631681635776262144,neutral,James Packer with singer Mariah Carey in Cannes in June Picture  
1711,631696455841935360,positive,Planning my trip with my friend to see Mariah Carey Febth cant wait to see my queen ToInfinity
1712,632172694088368128,positive,Omw to work bumping thiss Mariah Carey Bet NOT nobody fukc up my day I gotta short fuse so this feeling may 
1713,632248794965393409,positive,Best part of getting to the office first  choosing Friday tunes SO to Mariah Carey
1715,632380231295209472,positive,ion know the riaa site has Madonna then Mariah Carey innd
1716,632492216783634432,neutral,Anyone hey Julie whatd you do last night  Me nothing just creeped Mariah Careys instagram until the sun came up
1717,632773396183453697,negative,if you cant handle me blasting mariah carey fantasy on repeat with all of the windows open on a sunday arvo then dont live in rosebery nsw
1718,632877532719747072,neutral,Aka I should be doing productive sunday things but Im just watching Mariah Carey videos on youtube
1719,632885263316963328,neutral,some from peeps may recognise this chord progression from a mariah carey clip posted over on the AA groups 
1720,632982856910938112,negative,Mariah Carey I really havent paid attention to Madonna since about liketh orth grade when she used to be popular MELHOR SHADE
1721,633188773703086084,positive,A very laidback Mariah Carey made it family time only as she stepped out on Malibu beach on Wednesday with her adorable twins Moroccan
1722,633756177336143872,neutral,WONDERING IF Mariah Carey want to play some Concerts with us in OHIO after JAN an starting a TOUR contact JOHN MELSON
1723,633759021174927360,negative,fukkin loser its totally abt Mariah Carey however studies show now she may be oneupped by u
1724,633788310402371584,positive,OMG Mariah Carey performed at Israel I can still remember You Dont Mess With Zohan Israelis may be the happiest people last night D
1726,633876839501434880,negative,It is almost oclock in the morning I have school tomorrow and my roommate is singing Mariah Carey at the top of his lungs in the shower
1728,634277907590946816,positive,am augustth in my bedroom w all the lights off listening to all i want for christmas is you by mariah carey at full volume
1729,634408114532564992,positive,Have a great Thursday all of you  ONE SWEET DAY Mariah Carey amp Boyz II Men 
1730,634484413091319808,neutral,Full Mariah Carey walked somewhere amp then sat down for a bit coverage  day buythePaper
1731,634773010847825921,positive,Mariah Carey discography is untouchable No one is closer Yall know it but try to defend their faves  Janet is thend
1732,634865213741920256,positive,Listening to this Weeknd album This guy has thend best voice in the industry after Mariah Carey
