,Id,Category,Tweet
4309,636409358612623361,neutral,I did it bout times but I got something for TMobile as tomorrow believe that shit
4310,636475524798377984,neutral,I wont have service this ThursdayFriday because my contract with TMobile is ending so I have to wait to get a new one on Friday
4311,636643054301106176,positive,Tonights first meeting of theth ann ubalt zombie course kicks off with TMobile Sprint and Ashley Madison Waitwhat True 
4313,636758478183202816,negative,TMobile promised me next day air so if I dont have a brand new iPhone in my hand tomorrow after class theyre fake af
4314,636863673084936192,negative,TMobile be trippen my phone is off after I just payed it Friday tf  annoyed
4315,637063650524721152,negative,Tmobile needs to change their name to tmaybe because you may or may not have service
4316,637066623573082112,neutral,el oh el il see u tomorrow bro and sorry about my phone TMobile is garbage
4317,637069253414400000,negative,Seriously dont want a phone anymore Calling TMobile tomorrow to cancel this shit
4318,637081433018777601,positive,Hey I may not have TMobile but you are EASILY my favorite CEO probably of all time Definitely of all time sprintlikehell
4319,637223076342591488,negative,Two guys in Floriduh tried to rob a TMobile store after it closed on Tuesday night    but it happened to be 
4320,637377077289840641,neutral,I guess I will just check  back with TMOBILE on Octoberst halloween to see if they will get any new microsoft LUMIA smart phones
4321,637406940310601728,neutral,TMOBILE LIFE INSTORE CSRHi may I help you MEYes I cant access my pictures CSROKI dont have a note 
4322,637513497270579204,positive,If me and friends wanted to stop by the TMobile HQ on the way back from PAX Monday would that be cool
4323,637673846175232000,positive,I have no wired internet until Wednesday Currently relying on TMobile for access to the rest of the world
4324,637702995396927490,positive,Lumia and XL rumors ATampT and TMobile may get first dibs After official press renders of the Cityman 
4325,637726204389232640,positive,Free stuff available from mobile US carriers  ATampT Sprint TMobile Verizon  that you may not be aware of 
4326,637728970939629568,neutral,TMobile and band support in unlocked smartphones put in the spotlight  TmoNews   August Alex Wa 
4327,637745006602616832,neutral,TMobile stops sales of Lumia just two months after release   The Lumia went  August Cool Tech
4328,637760402814726144,negative,Billsmafia Im just saying  Today thest team Offense had no Harvin Watkins McCoy Tmobile with the crew is just damn scary
4329,637857408623243265,neutral,whole summer without a phone and the day I decide to spazz out on TMobile they tell me that my phone should be coming in tuesday
4330,638010060560592896,negative, claims they cant do anything but upgrade at my own costst month with them  should have stayed with TMobile contract AvoidEE
4331,638033869283938304,negative,TMobile said my bill is due when its due on theth smh
4333,638215956557271040,neutral,I think i might just walk to tmobile in get my phone tomorrow dont have no time to wait for my mom
4334,638250221105901568,negative,RT TMobile going after ~k Network Abusers on Mondaysome of them are using as m techyupds
4335,638294020008054785,negative,Tmobile Stopping Network Abusers An Open Letter to TMobile Customers   the only  August Cool Tech
4336,638346725523070976,neutral,From the rumors department Both Lumia  XL coming to ATampT while TMobile may carry only Lumia  NPU 
4337,638414224859918336,negative,TMobile cracking the whip on UnlimitedG LTE data abusers  TMobile starting tomorrow will be going after t 
4338,638496056280354816,negative,my Tmobile experience has been hell since I switched in April Do you care I have to call every month tmobilesucks
4339,638532037335494656,positive,FINALLY an apparently good smart phone with a keyboard coming soon to TMobile 
4340,638545633930952704,negative,You want to argue net neutrality use your brain and attack Comcast  Time Warner withGB limitsth of Tmobile Idiot
4342,638639776426397696,positive,Hopefully TMobile calls me tomorrow I want that new phone
4343,638753357977518080,negative,my texts arent working againfor thend day in a row cmon Sprint  U got me feeling like a TMobile customer 
4344,638953687348416512,neutral,Sent for my phone to get unlocked hopefully its tomorrow so I dont have to pay this cricket bill and can go to TMobile
4347,639107429242904576,positive,When I cant wait any longer st Gen X gt X PE cause I just moved to TMobile
4348,639315294624837633,positive,We have our TMobile Advantage Program you may qualify for  Check it out and see if youre eligible to get in on it
4349,639354456723734529,neutral,I have Tmobile its alright However my only complaint is what does the T even stand for Thug Thursday Terra Pls send halp
4350,639480000891240448,positive,TMobile announced a new builtin feature on Thursday that offers video calls to users who dont want to download 
4351,639595547490430976,positive,so this SundayMonday I am going to be coming over to TMobile I have an unlocked iPhones thats not from TMobile
4352,639620203475791872,positive,I posted photos on Facebook in the album TMobile Surprise Party Wine and Canvas Studio September 
4353,640037499889319936,positive,Did you know that TMobile was Trending Topic on Friday for hours in Detroit trndnl
4354,640170856510062593,neutral,hi there have just got and line Im having trouble logging into my account on the appst line on TMobile Help
4355,640194301897523200,positive,Our network is by far thend best in the world and as far as being second just you hide and watch I work for TMobile
4358,640637105954230272,neutral,the left is an ATampT and on the right side is a Tmobile phone Features of the device may vary by carrier Do you cont
4359,640711704125509633,neutral,The tmobile store in the auburn mall better have the phone I want tomorrow
4361,640779414582751232,neutral,no TMobile told me and kai aint no its as they release it on theth watch
4362,640887562811387905,neutral,If you currently do not have an active TMobile account you can tryrd party sites who can
4363,640958530103693312,positive,This is insane my TMobile LTE vs what I pay for TWC at home I think I may just cancel TWC internet 
4364,641257840317960192,positive,We hope everyone had an amazing holiday weekend Back to it  Heres our schedule  TUES TMobile HQ   WED 
4365,641336512706023424,neutral,I have TMobile so I may just switch
4366,641383137340182528,neutral,Apparently this is due to TMobile updating their LTE services in my area Well see if its fixed tomorrow 
4367,641388425388642304,negative,These past two days my calls and text been acting up TMobile is going to get a call from me tomorrow
4368,641417992786563077,positive,One thing I love about TMobile is that I may run out of high speed data but at least my shit is unlimited
4369,641419077471199232,positive,Ill  contact you guys on Friday aka Payday looks like Im saving  from TMobile already
4370,641419291657506816,positive,I may need you Depending on what happens with tmobile Do you offer any free phones or anything on sign up 
4371,640978566700793856,positive,Taylor Swift is going to be in Houston TX on Sep Get you tickets now at dont miss it
4372,640993271922061312,positive,Taylor swift or me Im thest one 
4373,641014076806557696,positive,Please tell me you are opening for Taylor Swift on Octoberth
4374,641020573481472000,positive,somebody take me to the taylor swift concert on wednesday
4375,641032295294472192,positive,Wildest Dreams by Taylor Swift is Tuesdays guitar tutorial  Check it out 
4376,641033005386088448,neutral,is a universal feminism concerning everyone as for taylor swift she may get into that category idk
4378,641035173275025409,positive,So Taylor swift is going to be in Columbus on Friday Septemberth WHOSE WITH ME
4379,641036267447287808,neutral,my sister turned last tuesday and taylor swift just tried to sue my family
4380,641049321899728897,positive,Wanna see Taylor Swift in concert has another pair Tuesday on our show at Ya gotta listen for the keyword to win
4381,641050756221661184,neutral,Did Taylor Swift really rip one on the air  What about that dong  and I discuss  RAW
4382,641059420143751168,positive,you may be cool but youll never be Taylor swift acting like a meerkat cool 
4383,641077671489835009,positive,Taylor Swift is Coming TorontoON Octobernd andrd at Rogers Centre  Get your Tickets Now Will you be in 
4384,641078571474255872,positive,singing taylor swift at a karaoke bar may be the best date idea ever AfterParadise BachelorInParadise
4385,641089812133363713,positive,Im serious if anyone is selling cheap tickets for Taylor swift on Wednesday let me know idc if its nosebleeds
4386,641091323597033472,positive,I got my Taylor swift pictures ready to go in my locker tomorrow just for you
4388,641105704854663168,positive,Yeah you Taylor SWIFT him may be one of the best reality TV lines Ive ever heard BachelorInParadise AfterParadise
4389,641106190659919872,positive,Here is what you need to do Listen to some Taylor Swift watch The Notebook have a good cry and youll feel better tomorrow
4391,641146431558971392,neutral,Ive never been shy or secretive about the fact that if you walk into my life you may be walking onto a record  Taylor Swift
4393,641196772556017665,positive,Dont worry You may think youll never get over it but you also thought it would last forever  Taylor Swift
4394,641200871674548224,positive,Just close your eyes the sun is going down Youll be alright no one can hurt you now  Taylor Swift
4395,641222505265369088,positive,Not entirely sure that I remembered deodorant but Taylor Swift is tomorrow so its like it doesnt even matter what else happens
4396,641229779954302976,positive,Did you ever think in your WildestDream that you would be going to see Taylor Swift tomorrow night at Minute 
4397,641233609613938688,positive,itweetFEEDS If Taylor Swift likes it you know it must be good On Monday the blonde beauty ff 
4398,641249800579608576,positive,Happy Tuesday loves Im so excited to share this Taylor Swift Inspired Tutorial with you all xox 
4399,641251185844948993,positive,I think I may be legitimately in love with Taylor swift
4400,641260282375868416,positive,Im going to be in the same room as Taylor Swift tomorrow
4401,641262014346625025,neutral,Watch Nicki Minaj call Miley Cyrus abtch onstage at the VMAs Nicki Minaj may have made up with Taylor Swift 
4402,641293277510021120,positive,I just want to look really good tomorrow and have a kick ass start of school assembly and dance to Taylor Swift
4403,641322123114450944,positive,So we hear that the singing sensation who goes by the name of Taylor Swift has a concert this Wednesday Why 
4404,641326668217470977,positive,I filmed the Wildest Dreams by Taylor Swift cover Ill upload it tomorrow I hope you see it 
4405,641331953980059648,positive,anyone houston beliebers going to see taylor swift tomorrow i want to meet uppppp
4406,641338133049573377,negative,Im so sad in class i was like  im seeing Taylor SWIFT tomorrow and everyone was like i fucking hate her shes so fake and ugly
4407,641350215518175232,negative,Well we know its not Taylor Swift SorrySwifties 
4408,641351542239399936,neutral,Wonder who Taylor Swift is going to bring onstage with her when she performs here in Houston tomorrow
4409,641354533679968256,positive,My professor just high fived me when I let him know Ill be skipping his class tomorrow for the Taylor Swift concert
4410,641355132467175424,negative,why is it so hard to win tiCKETS TO GO SEE TAYLOR SWIFT TOMORROW 
4411,641358046749323264,negative,So tomorrow I will be hating my sister and BIANCA because there going see Taylor swift and I am not
4412,641364951433502720,neutral,Everyone is already going to the Taylor swift concert  anyone not going that wants to go Sunday
4413,641367139387965440,neutral,Boys serious about this Taylor Swift concert tomorrow
4414,641369063889879040,positive,Jamming to Taylor Swift on the Tuesday after Labor day makes any day a good day
4415,641375379064795136,neutral,Who doesnt love a Taylor Swift parody about sun protection Share to promote sun protection and ski 
4416,641376417058414592,positive,Ready for the Taylor Swift concert tomorrow ShakeItOff Tour 
4417,641378373072195584,neutral,Great article on university data amp openness Feb of this yr Do you have any thoughts on which Us are embracing Taylor Swift
4418,641389047944904705,neutral,Ada Limantur Have you seen these fine Taylor Swift images You may like 
4421,641392276271403008,negative,The stress of the last hour makes me want to cry into my couch while listening to Taylor SwiftUntil I have to do it all again tomorrow
4425,641415924042481664,positive,Its about to get real TAYLOR SWIFT  
4426,641418159853993984,positive,Can Taylor Swift play her cover of Drops Of Jupiter tomorrow at the concert ok pls and thank you
4428,641421176443641856,positive,Happy earlynd bday hope you have a good one love you so much wonder if youre going to sing by Taylor Swift
4429,641425193190100992,positive,I want Taylor swift tickets for Minnesota this sunday 
4430,641427454800728064,positive,Sorry Im not really tweeting today Im getting ready for the Taylor Swift concert tomorrow
4431,641430368550170625,positive,Taylor Swift tomorrow night Probably should line up now to get in the venue by the time she gets onstage 
4432,641434186340020225,positive,Heading to the bottom theth Reds trail The sounds of Taylor Swift let us know Jay Bruce will get us started
4433,641436078201786368,positive,I would do anything to see taylor swift in concert on theth
4434,641440255212519425,positive,Ya girl is going to Taylor Swift tomorrow
4435,641444177105055745,positive,on friday i will breathe the same air as taylor swift
4436,641444760255770624,negative,tomorrow is the taylor swift concert where i live and i had tickets that i had to sell so tomorrow i will be crying all day
4437,641444852719161344,neutral,can I just skip tomorrow and go straight to the taylor swift concert
4439,641446775950176256,positive,Going to see Taylor Swift tomorrow with Laken and Im pumped af
4440,641452535757295616,positive,the first time I saw ed sheeran live he was opening up for taylor swift at the aaa tomorrow I see him headline the aaa
4442,641453487667048448,positive,taylor swift will be hours away  from me tomorrow i want to cry
4443,641454442685046784,neutral,Taylor Swiftgtgtgt chickFilA even if it were open on Sundays
4444,641455686291955712,neutral,Taylor Swift just waved at a boy and he didnt wave back so now shes got a new album coming out tomorrow
4445,641456345133158400,neutral,Am i the only one going to go see taylor swift tomorrow
4448,641463227713368064,positive,Counting down the days until I see Taylor Swift on thest
4451,641469149131218944,positive,ok but taylor swift is going to be on ellen tomorrow and I honestly do not care about anything else at the moment
4452,641469222271344641,negative,That moment when Taylor swift is here tomorrow and Im not going 
4453,641471628916846592,neutral,Look me in the eye and tell me you didnt listen to Taylor Swift inth grade
4454,641481228558970880,positive,But in other good news Im going to see Taylor Swift next Wednesday
4455,641491378774519808,neutral,Dino sat and Abby babbled that she liked Taylor Swift The Fray One republic and such
4456,641492923402465280,positive,Tomas Brown Have you seen these thoughtprovoking Taylor Swift images You may want to see 
4457,641494825108242432,positive,Bart De Brandt Resplendent Taylor Swift Images You may want to check 
4458,641496982066888704,positive,I just want to see Taylor Swift tomorrow okay
4460,641516100807622656,neutral,Bye Bye Kim K Taylor Swift is the new `Insta queen` Washington DC Sept With her million followers 
4461,641563639246397441,positive,congratulations on pumping Taylor Swift mate I may have misjudged you
4462,641573169564807168,positive,On the bright side I goT TAYLOR SWIFT CONCEET TICKWTS AGAIAN THIS IS MYth TS CONCERRT MOM ILYSM
4463,641575181740298240,neutral,Say you remember me Standing in a nice dress staring at the sun set babe  Taylor swift 
4464,641576792038473728,neutral,I wont play Taylor swift the entire time cmon please  me trying to convince Ricky to let me control the music newbrunswick
4465,641579872435830784,positive,and the search for Cornetto Disc limited edition Taylor Swift caramel shake caramel ice cream begins may the odds be ever in your favor
4466,641602994862202880,positive,Theyearold was spotted at the MTV Video Music Awards on Sunday night where she supported pal Taylor Swift as she took home the Video
4467,641612506100813824,positive,taylor swift radio for the next week and a half bc I am too pumped to see her in concert next Friday
4468,641619623671033856,neutral,Its Apple Keynote day  who will be the musical guest I say Dr Dre but others say Taylor Swift JustNotU  
4469,641626376563326977,positive,biggest question of the week is maybe which taylor swift record will i take to vinyl club on sunday
4470,641649121569345536,negative,My biology professor had the audacity to tell me enjoy that Taylor swift concertyou have a test + essay tomorrow 
4471,620748211318358016,neutral,I may be the only one that wont watch Ted
4472,620820906164813824,positive,Im gonna go see Ted tomorrow at the theater down the block matinee I cant be mad
4473,620849981931393024,positive,Jurassic World is such a great movie now I want to see Ted tomorrow
4474,620863433462841344,positive,Ted is way funnier then thest one
4475,620895806732701696,positive,I should be asleep but fuck it I dont got work tomorrow so Ill just watch Ted
4476,620952187510747137,neutral,Going for Ted with kouhai tomorrow u
4477,620968343810523136,positive,Reserved my movie ticket for Ted for this Saturday Hopefully the film be good as the first one which I liked
4478,621011244397559808,positive,I had a good weekend I just finished a week of night shifts on Saturday so I went out with my friends to see Ted
4479,621076468668477441,positive,Had a proper good laugh today watching Ted with Chris Au Every bit as good as thest film in my opinion well satisfied
4480,621079502505013248,positive,We had a blast recording the episode tonight Should be out tomorrow Can you guess which one of us enjoyed Ted
4481,621083339798249472,positive,iv been watching films all day and Im off to watch ted tomorrow with a few mates x
4482,621212335328198656,positive,broke a bill at work and got to see Ted with some cool people pretty good tuesday
4483,621309403661266944,positive,last night was so lovely out for dinner and then to see Ted with Alex Made a nice change from being sat in front of the telly
4486,621430307888173056,negative,Bloke sat behind me in the cinema loudly exclaimed Ant Man to be the stupidest idea ever and then laughed at Ted trailer Idiot
4487,621433383395135488,positive,Stuffed myself with a yummy spag bol from then founded the night off by watching Ted at Back to the gym tomorrow
4488,621475162257534976,positive,literally going to see ted tomorrow and then for my parentsth anniversary were going out ahh its gonna be good
4489,621501007856578560,positive,I want to thank so much my best friend treating me out to Pizza Hut for dinner and see Ted for myth birthday
4490,621509047825530880,positive,Went to the Yard HouseHad dinner amp happy hour drinksBefore we saw Ted movie Julyrd with my familyWe had fun
4491,621547755064946692,positive,I saw Ted on Tuesday man it was so funny
4494,621758429300977664,positive,Time to watch Ted with before I scoot on down to London Town tomorrow to party
4495,621771848150335488,positive,im going to watch ted on saturday
4497,621946986774728705,positive,I feel like someone should meet me at San tan tomorrow night after I get off work at and see Ted with me
4498,621957602877030400,positive,Ted was hilarious Time for bed and praying tomorrow is another good day
4499,621974257472536576,negative,know she definitely doesnt wanna see Ted tomorrow cuz u stupid
4500,622053281192353792,neutral,Almost saw you there I was going to see Ted but Id seen everything else so going Monday night to combine it with Ant Man
4501,622169226980274176,positive,hi we going to see ted at the Odeon cinemas at Glasgow on Wednesday  
4502,622198535392468993,positive,Anyone want to go see Ted tomorrow
4503,622222260787613696,neutral,Im going to the movies tomorrow and I wanted to go see Ted but my little sisters coming so Im going to see inside out instead
4504,622258433668984833,positive,Inside Out may be my favorite after Spy and Ted I want to see Terminator but Inside Out was fantastic
4505,622303721922424832,positive,saw Ted the other night big man right up your street Give Ted a watch too if you haventnd will then make more sense
4506,622318489911496705,neutral,my family gonna see Frozen sing along tomorrow night and Im just hoping to see Ted or the gallows again
4507,622513929168797698,positive,Just watched Ted thought was so much funnier than thest one Ted shithappens
4509,622610235140616192,positive,Mark Wahlberg is back as the ultimate best buddy John Bennett in TED Opens July 
4510,622623528647544832,positive,Ted was a great way to end myth Was cool to see Toxie in the film
4511,622634116052291584,neutral,Hes having his own personal I am Legend in my nutsack Funniest part of Ted thest was better
4512,622655674732797952,positive,A lazy Saturday called for Ted naps and  a hour intense room cleaning session with the one and only weekendsinloo
4513,622752615839977472,positive,we do but idk were going to watch ted on tuesday and he invited me to the winefestival in keszthely at the end of the month
4515,622888428263370757,positive,Get to see my bootiful face on the open tuesday wednesday thursday   Take me to see ted
4516,622957659914903552,positive,Ted was pretty funny However I am now singing Neil Diamond uncontrollably in the kitchen at on a Sunday night Oh well
4518,623014972633817089,positive,Brilliant Sunday Awesome result from the mighty Centurions followed by Ted wi the family Pure quality Every Sunday shud be that good
4519,623264478528962564,positive,Ted then bed No work tomorrow so im going to have a lie in then finish all my requests of tomorrow
4520,623274250510704640,positive,Just finished watching Ted it was really good cant wait Ted tomorrow night x
4521,623340183296081920,neutral,Yes sirth overall on the season Ive really only been effed one week thanks to Ted
4522,623361176089419776,neutral,Starts Friday   disaster action film SAN ANDREAS with Dwayne Johnson followed by TED with Mark Wahlberg 
4523,623378299838816257,positive,I wanna see Ted again for therd time that shit is so god damn funny
4524,623418435398189056,positive,Going to see Ted tomorrow with the lads
4526,623614966889848832,positive,Ted was lulz Not better than thest tho
4527,623625589845430272,positive,Gonna watch Ted for thend time tonight lol
4529,623749077939974144,positive,Todayspm show of JURASSIC WORLD and tomorrowspm of TED are your last chances to watch them with us  Tix 
4530,623938988903153664,positive,Time to give Ted a watch hopefully you dont need to have seen thest one to Get it
4534,624522478858047488,neutral,via Ted R  July  pm  Ted R  pm  Minor with parent or guardian  Tickets on  
4535,624736003698221057,neutral,I just saw Ted I havent seen so much penis masturbation and semen since the time I sat near Paul Reubens at a matinee
4537,625071677425209344,positive,Wow Ted was funnier than we thought Looking forward to tomorrow Reaping the jacket 
4538,625408569639354368,positive,Ted is such a good film  But thest film is slightly funnier
4539,625439476614045696,positive,shithappens ted  finished up watching ted going be a great Sunday
4540,625795774626934784,positive,you know what im going to see ted tonight and mad max tomorrow at the movies right next to me
4541,625886426748489728,positive,Sequels are rarely as good as thest Ted was a great and better than the original Well done 
4542,625888552216195073,positive,Im watching Ted for therd time in a row and Im cryiiiing of how funny it is
4543,626000213543682049,negative,Ted was shit antman was dec now its time for southpaw
4544,626171902130810880,negative,Ted was a disappointment considering how much i loved thest The Gollum part was hilarious though
4545,626498664966426624,neutral,not yet off to see Ted tomorrow instead Southpaw looks good want to see it at some point ExcitedForStagDo
4546,626585226240786432,positive,Anyone wanna go see the new mission impossible and Ted at the drive in Friday
4547,627207597167374336,positive,can you tell me if Ted will be showing at fork amp screen downtown disney on sat august please
4548,627359831003897856,positive,did you already see Ted Here it comes in the cinema on theth
4549,627476317508923393,positive,about to watch Ted for theth time
4550,627727098556198914,neutral,I have to get The Great Gatsby tomorrow and im debating whether or not I should pull the scene from Ted to whoever is working at BampNs
4552,628307454053498882,neutral,Tomorrow consists of going to the bank collecting my EEG results and going to the cinema to watch Ted
4554,629163982562193408,neutral,we are going to see Ted on theth
4555,629366088690724865,positive,Ted tonight Ted Baker tomorrow Ted talks playlists Teddy Sherringham in All things Ted Ted
4556,629402327028346882,positive,We sat down with the talented  to talk TED Check out what she had to say 
4557,629501748676145153,neutral,should i go see ted tonight or tomorrow night
4560,630780986368856066,positive,Adam were you at Ted last Friday in leicester square  when is anuvahood coming out I want to see that
4561,631003194458378240,negative,miss your bitch ass Go see Ted with me tomorrow at Dont be a bitch
4562,631697180374335488,positive,oh I saw it for and screening Sundays ago My friends got pissed I wouldnt let them see Ted
