,Id,Category,Tweet
1,635930169241374720,neutral,IOS App Transport Security Mm need to check if myrd party network pod supports it 
2,635950258682523648,neutral,Mar if you have an iOS device you should download our app too 
3,636030803433009153,negative,my phone does not run on latest IOS which may account for problem the other day  time it was replaced
4,636100906224848896,positive,Not sure how to start your publication on iOS Well be live helping with ask me anything sessions today and Friday 
5,636176272947744772,neutral,Two Dollar Tuesday is here with Forklift QuickKey for iOS and Suite for Pages for just  today   
6,636276311560859648,neutral,If youre not already signed up to test my iOS game nows your chance 
7,636302400546975744,neutral,YouTube Gaming Officially Launches On Web Android iOS On August YouTube is finally going to r webseries
8,636356154151575552,neutral,YouTube Gaming Launches Tomorrow with iOS and Android Apps to Go HeadtoHead with Twitch ios game
9,636360240921972736,neutral,Yashan from BBC the VPN access on IOS may be limited during Chinas military parade Any chance to have a chat on that
10,636440904967061504,positive,Parkrun app for iOS downloaded Where have you been before Great app easier access of info amp ready for Saturdays run 
11,636484190050119681,positive,Today launches with apps for iOS and Android devices in the US and UK here is what you need to know 
12,636567666048794624,positive,Got a project you want to work on Need help with Swift Need an excuse to hang with iOS devs on a Sat Hang with us 
13,636724154260176896,positive,Met with iOS Developer today We may have a go
14,636828460820729856,positive,CrossSkyHigh is going IOS saturday For now try this indiedev 
15,636878337105920000,positive,Whats the best way to get audio recordings from ard party app off of an iOS device Jailbreaking isnt an option
16,636907592036388865,positive,Five Great Free Apps and Games for iOS  Augustth Edition  Its that time of the week again News LCHBuzz
17,637003894611148800,neutral,looks interesting but Ive ALWAYS ended up back on iOS keyboard always glitches with iOSrd party ones
18,637018128111693824,positive,See news through the eyes of real people amp be your own reporter with Fresco for iOS coming Septemberth 
19,637085524683976704,positive,Siri knows all about Apples iOS event on theth GiveUsAHint 
20,637103428494188548,positive,Whos ready for Build Tomorrow Might be the last build till it come to iOS 
21,637176985479970817,positive,As Ive been on FB for many years I have a few hundred photo albums but only thest appear in the IOS app Is that right
22,637244817974657024,positive,try beat mp it may be on android i have it on ios and its fairly decent
23,637268613263720448,positive,Even though there are other differences in the IOS features this still may make people lean a little more towards Apple
24,637333676099932160,neutral,Huawei Watch PreOrder Suggests Android Wear Coming To iOS IPhone owners who want to use Android Wear may soo 
25,637423522130825216,neutral,SpeedeNews Rumor Android Wear will soon work with iOS  Android Wear may be very close to working with iOS That 
26,637515323059646464,neutral,Over here in NW nearth amp Rhode Island if you need a Lyft let me know   Download the LYFT app for IOS or Android 
27,637559397707874308,neutral,I wish that CustomFolderIcons worked on iOS and it was received on Decemberth
28,637567051490455552,neutral,So today i checked my old iPodth gen which is on iOS and it cant be upgraded further and i randomly open twitter
29,637581604253224960,negative,please stop walking and work  You have more than one month of late  The update was annonced the of july IOS wait
30,637615314897928192,positive, Hi i have heard that they said MCPE update will come today august to ios but i cant see that there is the update
31,637878764207214592,neutral,do you have any news of an update in October for ios and android users
32,637976948124160000,neutral,a followon guess might be that if you are female with an iOS device visiting the site you may have more disposable income
33,638206033639292932,positive,loving my new iPhone from TMobile Im in love with iOS Cant wait for the Septth event
34,638380514252992512,neutral,all Android wear is comparable with iOS now I believe I may be wrong though
35,638407042512719873,neutral,Google Expands Android Wear Smartwatch Platform to iOS   Google on Monday rolled out Android Wear smartwatch harmony with 
36,638427398694830080,negative,yes I asked an attendant to print out a paper pass But this was not thest time delta IOS app lost my login info Annoying
37,638429626419671040,positive,The two companies announced a partnership Monday aimed at making iOS devices and apps more compatible with FF
38,638458599803502592,positive,zeroes in on the latest in a short video Making iPhone amp iOS great for enterprisesst amp now 
39,638459896296538116,neutral,To all Nintendo fans out there I may sound crazy when I say this but Kirby and the rainbow curse andor Kirby canvas curse should be on iOS
40,638551243653165056,neutral,Apple hasnt ever focused on gaming but has enjoyed incredible success with iOS gaming Apple TV may focus on games 
41,638589551997513728,neutral,may want to pick your brains  looking to get into iOS dev myself
42,638614098482065410,positive,The Orks are here to tell you that were gunning for a Septth release of Herald of Oblivion on iOS and Android 
43,638703996379746304,neutral,rd party app on iOS Does it add a keyboard or you have to type gt copy gt paste  
44,638776033215447040,neutral,MT Webroot Have a jailbroken iOS device You may want to reconsider 
45,638828126097682432,neutral,i have the Ipod Touchth and i have the IOSofc i cant downgrade because is not being signdedso now what i supposed to do
46,638857391686184961,positive,Making my way through your Managing iOS and Macsnd Ed book Great read really well done Thanks for doing this keep it up
47,638886628602155008,neutral,Googles Android Wear for iOS confirmed incompatible with Apples HealthKit In announcing Android Wear for iOS on Monday Google not
48,638927700648964096,neutral,Hi Lee my iPhone is currently operating on IOSdo I have to put IOSst or can upload IOS if so how do I go about it 
49,638945625548173312,positive,wed nightpm pacific join the The BLAST live right here on FB as we have the founders of the IOS app Kander on 
50,639001381655982080,positive,codigamesDo you like ARPGsDungeon Legends arrive to iOS on Septemberrd gamedev iphone 
51,639016946541850624,neutral,Jailbreaking iOS Devices May Not Be The Best Idea Security vulnerabilities in the iOS can rarely be security
52,639071474754711552,positive,Come and have the FIRST EVER GO on Lumino City on iOS + real models Friday til Sunday 
53,639085295351132161,neutral,Rumor has it that a certain app is available on iOS and its FREE  Android coming Friday 
54,639115503492038656,neutral,So far weve announced iOS and Android versions and we focus on them This may change in the future though
55,639117172204138496,neutral,May favorite one EVER on iOS is Harbaugh it autocorrects to Garbage
56,639217575298248704,neutral,do u know if the motond gen will work with iOS devices
58,639456517008326656,positive,My best guess is we should see MCPE submitted to IOS and Google by the end of week or into Monday if the devs have cleaned up the bugs
59,639485295218585600,positive,The next Pixel Dungeon update for Steam and iOS with a lot of new features and improvements will be released on Septemberth
60,639542718117490688,neutral,Thursday Night on KXLU Get the app for IOS or Android at and LISTEN 
62,639731200492482560,neutral,Been using Vodafones smart ultra since Tuesday Cant get the hang of it and finding a few faults with android Back to IOS I think
63,639806019665793024,neutral,Meet your new old favorite endless runner for iOS Race the Sun  Macworld 
64,639825263187128320,positive,Are you ready for our new app launch tomorrow Build binaries for IOS Android Windows Phones and Tablets 
65,639886266843164672,neutral,BTW I amp others have run into a fair number of cataloguing issues with the Apple Music update in iOS This may be a symptom
66,639899879955935232,positive,This hopefully means that MCPE will come out for IOS around theth of September along with all other versions
67,640017715894206464,positive,What you should look for from Apples September event A new version of iOS will likely arrive with those sh 
68,640163020539203584,neutral,Want to speed up your sharing Automate a few things from your iOS device Workflow may be the solution 
69,640184988172963840,positive,thank you now I may actually have a chance on ios now
70,640305299270799364,positive,articlesection classpagepAndroid Wear may be very close to working with iOS
73,640350165879144448,positive,Hey Tommaso when is the release date for on iOS If the answer is around theth thats where my school starts
75,640515279873830912,positive, DAYCrowdViz releases on Labor Day Septemberth An IOS app that unites blind people with sighted assistants 
76,640604280706076672,positive,WHO CANT WAIT FOR MINECRAFT ON IOS BUT NOW U DONT HAVE TO WAIT CAUSE IT WILL BE SUBMITTED ATth september day left
77,640640481714638848,neutral,Its quite funny to see iOS developers taking advantage of the new Ugmonkth Anniversary set
79,640862561236185090,positive,links are working fine on my IOS device Some times on the first click I get a open in safari  Cancel it amp do and click Works
80,640985843851767808,positive,all device build tomorrow or official WPandroidIOS  Hehe P yay happy day for you 
81,641021806061621248,neutral,so the for IOS will be out tomorrow correct
82,641105483122798592,positive,Tech AndroidgtStar Wars Uprising launches September on iOS and Android  GB Star Wars canon is about tmobile
83,641288798790418432,positive,hi I was wondering do u mean youll try to release MCPE to iOS tomorrow Ps your awesome
85,641433564836290560,positive,Check out my ride in CSRRacing for iOS Try it for FREE now car 
86,641438788472991744,neutral,Apple releases what the next iPhones and IOS will be like tomorrow
87,641441832291934208,positive,You can download for iOS and the show or server wont work until tomorrow be happy and SMILE MORE 
88,641482982688075776,positive,Those of you with iOS devices ask Siri to give you a hint about tomorrows Apple keynote 
89,641485888673812480,positive,I dont operate any iOS devices anymore but Ill still tune into the big show tomorrow Still fun to watch the event and see whats what
90,641488560437260288,neutral,Not sure what you mean Continuity doesnt require a separaterd device Watch for two other iOS devices to pair and share
91,641494998010200064,negative,ok inbox on iOS has a pretty animation for the sun but thew android version doesnt 
92,641542106306101248,neutral,the only time i would say i really enjoyed IOS was fifa before i got my console in may soon as i got that i stopped playing it
93,641632558996811776,positive,Wanna watch the iPhone announcement LIVE With any iOS device Safari Browser watch here starting AM PST 
94,641642814632124416,positive,ATTN Beginning Octst Munzee will be the only app available for iOS and Android Also is in review and includes bug fixes
95,641653401877618688,positive,Did you know that we are launching Tower Dwellers Gold on Android tomorrow in tandem with iOS  
96,641655091468963840,neutral,iOS Developer  THBangkok Market Rate  My client is the larges 
97,641670426284945408,positive,Like legit though if it was running OS X it would be a sick product But since its running IOS you may as well get a retina
98,641323950056841216,positive,Join the MOVable Challenge Get your MOVband at Spirit Fest tomorrow or Thursday and move one step closer to an iPad 
99,641328263822999555,positive,tomorrow is another big day in the tech world Im guessing a new upgraded  iPhone iPad and possibly new OS 
100,641328586276925440,negative,Lost my iPad for thend time today
102,641336034672922625,positive,Woods Club Come to room after school next tuesday to make iPad Stands 
103,641341629689786369,neutral,A survey question ahead of tomorrows announcements Whats the right price for aninch iPad w stylus and keyboard cover
104,641342629074984960,positive,Really excited about Apple Announcing iPad Pro tomorrow Ah the rumor Ive been wanting to be true for years It 
105,641345456740503553,positive,So excited to see what Apple announces My wish  a huge iPad that I can draw on with a stylus tech
106,641349256020815872,neutral,Apple might want to give devs a little info on iPad Pro before dropping it and iOS on the market in November ht 
107,641351041884164097,positive,Sat next to a woman on the plane today who flipped through photos of her cat on her iPad the whole time spiritanimal
108,641351360965832705,positive,Tomorrow the day Apple reveals a new iPhone amp iPad SoAnxious I want both items ASAP
109,641352166305693696,positive,Prediction for tomorrow iPhonecs ands+ a iPad and a new Apple TV with touchscreen controller applegenius stillnojobthough
110,641357966315139073,positive,Rumor is that Apples big announcement tomorrow is a giant iPad Please God  please let them call it the MaxiPad AppleEvent Apple
111,641366721287204864,positive,Tomorrow Capturing Covent Garden with iPhone and iPad Septemberam Apple Store Covent Garden Free 
112,641376359034568704,negative,Im at my follow limit Rude I will go on my iPad tomorrow and unfollow all the little bitches who aint following back K bye
113,641378641339940864,positive,Wouldnt be surprised if the new iPhone unveiled tomorrow is actually an iPad mini
114,641383082923196416,positive,thanks tea sounds good but gotta update the iPadst
116,641392431653453824,positive,I hope they announce something different and exciting for the iPad tomorrow Its just about time for me to get a new one AppleEvent
117,641393122216423424,positive,Reading prelude to tomorrows Apple event cant help but think is the new WSJ Bloomberg or NYT re iPad news
118,641402358564548608,positive,Traded in the new computer to get an iPad Uncle tells me new iPad will be announced tomorrow so prices should drop 
119,641403638267535360,positive,Apples Keynote is happening tomorrow atamWith the expected announcement of the iPhoneS new Apple TV and iPad who is waking up for it
121,641406276879187969,positive,The only thing Im looking forward to tomorrow is the new iPhone and iPad Pro
122,641408450463817728,neutral,what she gonna buy with th of an ipad  
123,641411462121058304,positive,I hope I get my iPad tomorrow so I can stream the Apple Keynote Address in school
125,641414401426223104,positive,Does it really have iPad pro amp stylus tomorrow will have answer
126,641416176304680960,neutral,if you are using an iPhone or iPad you may not be able to view it their youtube app  Try on your computer
127,641417400110354432,neutral,Tomorrow Apple better introduce an iPad large enough for me to stand on with an app thatll transport me wherever I want to go If not
128,641418673014620160,positive,But with a new iPad coming out I may be able to snag an older iPad at a decent price
129,641419174363930624,positive,First day of school tomorrow which means its also the first day of the season for RBI baseball on my iPad
130,641423309318582272,negative,are yall really mad that hes paying  to fix a broken iPad dont yall have bigger problems to deal with  
131,641424370942939136,positive,And Apple goes gesture controlled gaming with Apple TV Will the phone and iPad upgrades impress  
132,641424651495698432,positive,Apple to unveil iPhones iPad today For the first time they are releasing on Wednesday All their earlier releases were on a Tuesday
133,641425847791042560,negative,When you have tests tomorrow and a lab to do but your iPad is dead so you cant do shit 
134,641430507683606528,negative,Highly doubt that iPad will be covered during the AppleEvent tomorrow 
135,641432777615933440,positive,So tomorrow is the big Apple event What do you think well see iPad Pro An iPad Stylus Curious to see what they bring
137,641436035013038080,neutral,Checks will not be submitted tomorrow but Ill end up taking the extra time for a watch app NC widget iPad optimization etc
138,641436513390080000,positive,my moms taking my iPad away tomorrow but its worth it because Im tweeting the KWEENT ANTHONYCHAT
139,641436882128248832,positive,Which is more interesting unveil tomorrow AAPLs Ipad TV or TM new Prius Im going with Prius
140,641442231409242112,positive,To prepare for the AppleEvent tomorrow I am reminiscing over legacy apple hardware including iPodnd Gen iPhone iPad Get Pumped
141,641444286341365760,positive,Sundays vlog is processing Mondays is exporting You know for having to do it all on a iPad is say Im doing pretty good
142,641445586445537281,positive,Id buy the next iPad if they had Fassbender give the keynote tomorrow
143,641447893677817857,positive,I believe the new Twitter update comes in time before tomorrow event Might be seeing deeper integration with iPad Pro SplitScreen iOS
144,641447913525276672,positive,Tomorrow Apple Inc will introduce theS a new Apple TV and the iPad Pro
145,641451096427266048,negative,Accidentally left iPad sitting in the sun too long Had to stash her in the freezer to cool down whoops straya
147,641460027002355712,neutral,hi ive trying to contact quantas bu phone with no success since last thursdayi left an ipad in a plane could you help me
148,641479328216150016,negative,My dad just dramatically got upset at me for no reason but I was getting an iPad tomorrow so now what
149,641480750265602050,positive,hahah Excited for your live blog tomorrow I know the rumors are strong but I remain dubious about the iPad pro being announced
150,641483234996436992,neutral,I cant tell if it is working on my blog I will have to check tomorrow on the computer I was using my iPad
151,641493880555347968,positive,Why spec Noritz We want to know Submit a vid before Oct explaining why amp you could win an iPad NoritzPro
152,641501437675986944,neutral,I still doubt Apple will announce new iPad at tomorrows event Apple might dedicate most of the keynote on new Apple TV
153,641501884243689472,positive,I see I hope it will survive If not you only have new when things break Apple may announce a big size iPad tomorrow
154,641510515974365185,negative,ok so i want to cry like my expected delivery date for my ipad is thursday which is AFTER i leave like this is the absolute worst
155,641511906897883136,neutral,Uniting until yours postexistence bandeau it may be take effect actuary out the ipad onwards from desktop verge
156,641515406319071232,positive,Apple is expected to unveil iPhones an Apple TV amp a larger iPad Watch the live stream tonight atpm here tech
157,641524008987566080,neutral,Should you upgrade from Adobe CS Suite CS came out before thest iPad mini was released in the same month Facebook bought Instagram
158,641526339636457472,neutral,if Apple wants to sell me an iPad theyd better announce it tomorrow
159,641528223457746944,neutral,Apple to show the iPhoneS updates to the iPad Apple TV and other products today 
160,641539550104281088,neutral,st u knew dat there wud b a lot of ppl chasing after harry so yd u bring ur ipad w u U couldve just used ur phone 
161,641539752177586176,negative,Andnd it wasnt harrys fault that he had ran over your ipad so whyd you ask him to pay for the crack like wtf 
162,641560030945259520,neutral,Literally anxious abt the iPad pro announcement today You gonna disappoint again Apple or is it srsly thend last product Ill need from u
163,641560327159726080,positive,If your pupils can use an iPad better than you can then this course may well be ideal for you  
165,641565807810617344,neutral,st he smashed someones phone now ran over an iPad he hates you all 
166,641574514619514880,positive,Also the iPhoneSS Plus and the new iPad will be coming out tomorrow morning Will be checking out the highlights
167,641579580176732160,neutral,my memory  doesnt have more space So i cant download it  but ill try to download it tomorrow from iPad
168,641584057386704896,neutral,Do you think it knows that in a couple of hours it may be one step closer to obsolescence and outpaced by a giant iPad at that
171,641592893841481728,negative,Pausing on this day of myst year to yell at my ipad because pandora refuses to play the Carpenters Superstar
172,641595961068900352,positive,Giant iPad anyone Dont forget to check out the Apple Event atpm EST apple charlotte 
173,641597241141129217,neutral,Just  for the Hebrew Crash Course by Friday Get Survival Phrases for the iPad or Mac 
174,641602592401821697,positive,iPad Pro Apple TV expected to take center stage Wednesday Its that time of the year For five years Apple  
175,641603220977131520,neutral,Top Gambling Apps for the iPad 
176,641604722043039745,positive,Cant wait to see the iPad Plus  Apple AppleEvent TimCook  
177,641608296160448512,neutral,The Accounting Career Fair is this Friday Be sure to engage with us by using kubusfairyou might win an iPad mini
178,641610320293695489,positive,New iPhones iPad Pro and Apple TV on the way today at AM PDT AppleEvent 
179,641618110835888129,neutral,I wanna go find the iPad so I can watch videos and train muh pokeymanz rip iPod D  tomorrow marks two weeks
180,641618508028248064,positive,Is that I am very excited to share on Instagram brings their app to iPad and redesigns the iWatch in November
181,641621458293276672,neutral,waitI may reconsider my decision to get surface pro if ipad pro comes with a stylus with pressure sensitivity
182,641625805508841472,positive,castleberryisdth grade iPad Deployment going well Students are excited 
183,641629037337559040,neutral,I cant stop hope the iPad goes flat I gotta work tomorrow GO TIGES GO TIGES GO TIGES GO TIGES GO TIGES
184,641630235050405888,positive,Happy Apple Fanboy Day May the iPad be with you
185,641633293729943552,positive,It was fun to see the excitement on theth graders faces And some of them seem to be iPad pros already 
186,641634655310086144,positive,st gen iPad mini still going strong Love that little guy
187,641635160526594048,positive,Looking forward to the AppleEvent today It will make for interestingth Quarter results w an upgrade to the iPhone iPad and Apple TV
188,641638054655082496,neutral,Does he mean a tv or a giant iPad  
189,641638185773039618,negative,Did he just spoil the iPad Pro  
190,641639304075329537,positive,Here comes the new Apple TV And the iPad Pro 
191,641642101936013312,negative,whys he flossin an iPhoneG original iPad anth gen MacBook like he got money lmao
192,641646335133790209,positive,Its the best I cant wait to christen my new patio on September with some coffee and RedZone on ipad
193,641649546557304832,positive,Who is ready for the iPad Pro Today may be the day
194,641651311746744320,positive,Did you know you can split the keyboard on your iPad I didnt Here are some Ninja tricks for the iPad you may 
196,641656919627821057,neutral,iPhone iPad or iPod touch Mac with Safari PC with Microsoft Edge on Windows AppleEvent
200,641496447460986880,positive,iPhone event recap video tonight then Transloader for Mac app review on Saturday Cool content coming up 
201,641497055098114048,positive,Golf with the dudes no work pool day and the new iPhone announcement Tomorrow shall be a good day
202,641497345381675008,neutral,When will the iPhone price drop Immediately after the septh announcement or not and how much will it drop
203,641497711284518912,positive, hours until Apple announces the iPhoneS heres what to expect 
204,641499690362630144,positive,New iPhone announcement tonight If I dont get one ordered tomorrow with for my upgrade there will probably be tears
206,641501728064466945,positive,Who is as excited as I am about announcement tomorrow  I havent had a new iPhone since theS  Im ready blogchat
207,641502415192068096,positive,The new iPhone is announced tomorrow I already want it
208,641504800488620033,neutral,If you bought an iPhone today you lost New ones get introduced tomorrow                             Dont lose win
209,641508289814102017,positive,The numeracy map just fits into an iPhone bringing it alive digitally Search the AppStorest level free 
210,641509708747010048,neutral,The new iPhone will be announced tonight atAM th Sept Heres how to watch it live 
211,641509725226553344,neutral,While all eyes may be on the new iPhone today this Apple product will be the most disruptive 
212,641511919778574337,positive,Apple is hosting its annual splash on Wednesday to unveil a new version of its best product the iPhone Africapkenya 
213,641512927225208832,positive,Im so excited for the new iphone release tomorrow yas
214,641515507892400129,neutral,Apple will be hosting its next iPhone reveal event on September atAM PST You can watch a live stream of the event at GameSpots 
215,641516638630715392,neutral,Todays theth Weve got some apple news coming I just want to get on with it amp upgrade my iPhone
216,641516726878777344,positive,Ready for the Keynote tomorrow Is iPhone the right choice for me Next time on Dragon Ball Z
217,641517448831700992,neutral,Alex Gibney explains why his Steve Jobs documentary may cause you to put down your iPhone for good via 
218,641518004707192832,positive,Started the day listening to new iPhone reveal later and the NFL is back tomorrow Happy hump day
220,641519726817071104,neutral,Today my doctor diagnosed me with a repetitive strain injury known as iPhone thumb May my social media use be a cautionary tale to all
221,641521527461163008,positive,Today Septth Apple announces details on how iPhone will work with Adblockers onlineadvertisers in the future
222,641526144458559488,positive,Beyond excited for the Apple Event tomorrow Mostly for new Apple Watch bands as Ill be trying not to get the new iPhone
223,641529318703697920,positive,New IPhone its a relegious day 
